Key,English,Korean,PortugueseBrazil,Portuguese,Japanese,German,Spanish,Thai,Polish,Lithuanian,Dutch,Indonesian,French,Russian,Cambodian,Urdu,ChineseSimplified,Hungarian
UI_PROCEED_DISCORD_CONTENT,Open the link to Nine Chronicles Discord channel?,나인 크로니클 디스코드 채널로 이동하시겠습니까?,Abrir o link para o canal Discord do Nine Chronicles?,,ナインクロニクルのDiscordグループへのリンクを開きますか？,Willst du den Link zum Nine Chronicles Discord Server öffnen?,,คุณต้องการไปที่ช่อง Nine Chronicle Discord หรือไม่?,Otwórz łącze do kanału Nine Chronicles Discord?,,,Buka link ke Nine Chronicles Discord channel?,Ouvrir le lien vers le Canal Discord de Nine Chronicles ?,,,,打开链接进入Nine Chronicles 的Discord频道？,
UI_WARRIOR_DESCRIPTION,"The warrior class is good at close combat and is always on the front line of battle. It features an overlapping combo system. The more successive hits, the greater the damage.","전사는 근접 전투에 능하고 방어력이 높아,
항상 전투의 최전방에 선다.
중첩되는 콤보 시스템이 특징이며,
연타에 성공하면 점점 더 강해진다.","O guerreiro é bom em combate corpo a corpo e está sempre na linha de frente da batalha. Ele contém uma sistema de seleção, mais você bateu, maior o prejuízo.",,"ウォーリアーは近接戦に長け、常に戦いの最前線に立ちます。
攻撃を重ねるコンボシステムが特徴で、連続ヒットによりダメージが上昇します。","Der Krieger ist gut im Nahkampf und immer an vorderster Front der Schlacht. Er verfügt über ein mächtiges Kombosystem: Je öfter man trifft, dest mehr Schaden verursacht man",,"นักรบเก่งในการต่อสู้ระยะประชิดจะมีพลังป้องกันสูง
และอยู่ในแนวหน้าของการต่อสู้เสมอ
มีระบบคอมโบที่ทับซ้อนกัน
ยิ่งคุณโจมตีมากเท่าไหร่ความเสียหายก็ยิ่งมากขึ้นเท่านั้น","Klasa wojownika jest dobra w walce w zwarciu i zawsze znajduje się na pierwszej linii frontu. Posiada nakładający się system combo. Im więcej kolejnych trafień, tym większe obrażenia.",,,"Pendekar ahli dalam pertempuran jarak dekat dan selalu berada di garis depan pertempuran. Ini fitur sistem kombo yang tumpang tindih, semakin banyak Anda memukul, semakin besar serangannya.",La classe guerrier est bonne en mêlée et est toujours sur la ligne de front en combat. Elle offre un système de combos successif. Plus tu portes de coups successifs et plus les dégâts seront grands.,,,,战士类擅长近战，始终处于战斗的最前线。它具有重叠的组合系统。击中的次数越多，造成的伤害越大。,
SPEECH_SHOP_BUY_0,"There's a lot of
good stuff on sale.
Come take a look!","좋은 물건이 많이 올라와있어!
시간 나면 보고 가","Há muita coisa boa
chegando.",,"掘り出し物が
続々と入荷中よ！",Es stehen viele gute Sachen an.,,"ยังมีของดีอีกเยอะ
ที่กำลังจะมา","Nadchodzi wiele
dobrych rzeczy.",,,"Akan ada banyak sekali
barang bagus datang.
Ayo lihat!","Il y a plein de
bons trucs en vente.
Viens jeter un coup d’œil.",,,,涌现出很多好东西。,
SPEECH_SHOP_BUY_1,"You need different equipment
to prepare for the ordeal.",다양한 장비가 있어야 시련을 대비할 수 있어,"Você precisa de equipamentos diferentes
para se preparar para o calvário.",,厳しい戦いに備えて色々な装備が必要よ！,"Du brauchst verschiedene Ausrüstung,
um dich auf deine Probe vorzubereiten.",,"คุณจะต้องมีอุปกรณ์ที่หลากหลาย
เพื่อเตรียมพร้อมสำหรับการทดสอบ","Musisz przygotować zróżnicowany
ekwipunek na tę próbę .",,,"Anda membutuhkan perlengkapan yang berbeda
untuk persiapan cobaan itu.","Tu vas avoir besoin d'équipements variés
pour te préparer à cette épreuve.",,,,您需要不同的设备来准备磨难。,
SPEECH_SHOP_SELL_0,"If you are unsure about your item's price,
check out how much other people
are selling them for.","판매 가격이 고민되면
다른 사람들이
얼마에 올렸는지 잘 살펴봐","Quando você estiver preocupado com a
de definir o preço certo
confira o que as outras pessoas
estão vendendo.",,"売値に困ったら、他の人の
値付けを参考にするといいわ！","Wenn du nicht weißt was der
richtige Preis für deine Ware ist,
kannst du dir ansehen zu welchem
Preis andere Leute sie verkaufen.",,"ถ้าคุณไม่หมั่นใจเรื่องราคาขาย
ลองดูราคาของบุคคลอื่น
ที่กำลังขายอยู่","Jeśli nie masz pewności co do ceny przedmiotu,
sprawdź, za ile sprzedają go inni.",,,"Jika Anda tidak yakin dengan harga barang Anda,
lihat harga orang lain
menjualnya.","Si tu hésites sur le prix de tes articles,
regarde pour combien les autres
les vendent.",,,,如果您不确定物品的价格，请查看其他人以多少价格出售这些物品。,
SPEECH_SHOP_SELL_1,You can always retrieve items that are unsold.,"아직 팔리지 않은 물건은
언제든지 다시 회수할 수 있어","Você sempre pode recuperar itens
que não foram vendidos.",,"出品中の商品は
いつでもキャンセルできるわ。","Du kannst Gegenstände, die nicht
verkauft wurden, immer zurückholen.",,"ของชิ้นไหนที่ขายไม่ออก
คุณสามารถเรียกคืนได้ตลอดเวลา",Zawsze możesz anulować wystawione ogłoszenia.,,,"Anda selalu dapat mengambil item
yang belum terjual.",Tu peux toujours reprendre les articles invendus.,,,,您始终可以检索未售出的物品。,
SPEECH_SHOP_REGISTER_ITEM_0,"If you are unsure about your item's price,
check out how much other people
are selling them for.","판매 가격이 고민되면
다른 사람들이
얼마에 올렸는지 잘 살펴봐","Quando você estiver preocupado com a
de definir o preço certo
confira o que as outras pessoas
estão vendendo.",,"売値に困ったら、他の人の
値付けを参考にするといいわ！","Wenn du nicht weißt was der
richtige Preis für deine Ware ist,
kannst du dir ansehen zu welchem
Preis andere Leute sie verkaufen.",,"ถ้าคุณไม่หมั่นใจเรื่องราคาขาย
ลองดูราคาของบุคคลอื่น
ที่กำลังขายอยู่","Jeśli nie masz pewności co do ceny przedmiotu,
sprawdź, za ile sprzedają go inni.",,,"Jika Anda tidak yakin dengan harga barang Anda,
lihat harga orang lain
menjualnya.","Si tu hésites sur le prix de tes articles,
regarde pour combien les autres
les vendent.",,,,如果不确定您的物品的价格，请查看其他人卖给他们的价格。,
SPEECH_SHOP_GREETING_0,"You need different equipment
to prepare for the ordeal.",다양한 장비가 있어야 시련을 대비할 수 있어,"Você precisa de equipamento diferentes
para se preparar para o calvário.",,厳しい戦いに備えて色々な装備が必要よ！,"Du brauchst verschiedene Ausrüstung,
um dich auf deine Probe vorzubereiten.",,"คุณจะต้องมีอุปกรณ์ที่หลากหลาย
เพื่อเตรียมพร้อมสำหรับการทดสอบ","Musisz przygotować zróżnicowany
ekwipunek na tę próbę.",,,"Anda membutuhkan perlengkapan yang berbeda
untuk persiapan cobaan itu.","Tu vas avoir besoin de différents équipements
pour te préparer à cette épreuve.",,,,您需要不同的设备来准备这项磨难。,
SPEECH_COMBINE_GREETING_0,"The higher the grade
the more slots there will be...
What? You're already aware of that?","높은 등급의 무기일수록
많은 옵션이 붙지..
뭐? 그것까지 알려줄 필욘 없다고? 흥!","Quanto maior a graduação
mais espaços existem ...
O que? Você já sabia disso?",,"グレードが上がると追加効果も増えるんだぜ…
なに？　もう知ってるだと？","Je höher die Stufe,
desto mehr Möglichkeiten hast du...
Wie bitte? Du weißt das bereits? Super!",,"ยิ่งเกรดสูง
ยิ่งมีช่องมากขึ้น ...
อะไรน่ะ? คุณรู้อยู่แล้ว?","Im wyższy poziom przedmiotu,
tym więcej pojawi się opcji…
Co!? Już o tym wiedziałeś? Kto by się spodziewał!",,,"Semakin tinggi tingkatannya
semakin banyak slot akan ada ...
Apa? Anda sudah mengetahuinya?","Plus le rang est élevé
et plus il y aura d'emplacements...
Hein ? Tu es déjà au courant de tout ça ?",,,,"等级越高，那里的插槽越多...什么？
您已经意识到这一点吗？",
SPEECH_COMBINE_EQUIPMENT_0,Are we here to make equipment? Cooking and upgrades are also very helpful in combat.,장비를 만들러 왔나? 요리 제작이나 강화도 큰 도움이 된다네.,Estamos aqui para fazer equipamento? Cozinhar e atualizações também são muito úteis em combate.,,私たちは機器を作るためにここにいますか？調理とアップグレードも戦闘で非常に役立ちます。,"Sind wir hier, um Ausrüstung zu machen? Kochen und Upgrades sind auch im Kampf sehr hilfreich.",¿Estamos aquí para hacer equipo? Cocinar y actualizaciones también son muy útiles en combate.,เราอยู่ที่นี่เพื่อสร้างอุปกรณ์หรือไม่ การทำอาหารและการอัพเกรดก็มีประโยชน์มากในการต่อสู้,"Czy jesteśmy tutaj, aby zrobić sprzęt? Gotowanie i aktualizacje są również bardzo pomocne w walce.","Ar mes esame čia, kad padarytume įrangą? Virimo ir atnaujinimai taip pat yra labai naudingi kovoje.",Zijn we hier om apparatuur te maken? Koken en upgrades zijn ook erg handig in Combat.,Apakah kita di sini untuk membuat peralatan? Memasak dan upgrade juga sangat membantu dalam pertempuran.,Sommes-nous ici pour faire du matériel? La cuisson et les mises à niveau sont également très utiles au combat.,"Мы здесь, чтобы сделать оборудование? Приготовление пищи и обновления также очень полезно в бою.",តើយើងមកទីនេះដើម្បីបង្កើតឧបករណ៍ទេ? ការចំអិនម្ហូបនិងការធ្វើឱ្យប្រសើរក៏មានប្រយោជន៍ខ្លាំងផងដែរក្នុងការប្រយុទ្ធ។,,我们在这里制作设备吗？烹饪和升级在战斗中也非常有用。,
SPEECH_COMBINE_CONSUMABLE_0,"Consumable items disappear
upon usage,
but their effect is powerful.","소모템은 한번 쓰면 사라지지만
그만큼 효과가 강력하다오","O item consumível desaparece
depois que você o usa
mas tem um efeito forte.",,"消耗品は使うと無くなっちまうが
効き目はバッチリだ。","Verbrauchsgegenstände
verschwinden bei Gebrauch,
aber die Wirkung ist stark.",,"ไอเทมสิ้นเปลืองจะหายไป
ตามการใช้งาน
แต่มันมีผลดีอย่างมาก","Przedmioty użytkowe znikają
po użyciu,
ale efekt jaki dają jest bardzo pomocny.",,,"Barang komsumsi habis
setelah Anda menggunakannya
tetapi memiliki efek yang kuat.","Les consommables disparaissent
après leur utilisation,
mais leur effet est puissant.",,,,消耗性物品消失后的用法，但效果很强。,
SPEECH_COMBINE_ENHANCE_EQUIPMENT_0,You can combine two pieces of equipment into one.,두 장비를 합칠 수 있어.,Você pode combinar dois equipamentos em um.,,2 つの装備品を組み合わせて 1 つにできるぞ。,Du kannst zwei Gegenstände zu einem kombinieren.,,คุณสามารถรวมอุปกรณ์สองชิ้นเข้าด้วยกัน,Możesz połączyć dwa przedmioty w jeden.,,,Anda bisa menggabungkan dua perlengkapan menjadi satu.,Tu peux combiner deux équipements en un.,,,,您可以将两个设备组合为一个。,
SPEECH_COMBINE_STAGE_MATERIAL_0,You have to choose the same line of equipment as the material.,같은 장비 끼리만 합칠 수 있어!,Você tem que escolher a mesma linha de equipamentos como o material.,,あなたは、材料と機器の同じ行を選択する必要があります。,Sie haben die gleiche Art von Ausrüstung wie das Material zu wählen.,Tienes que elegir la misma línea de equipos como el material.,คุณต้องเลือกบรรทัดเดียวกันของอุปกรณ์เป็นวัสดุ,"Musisz wybrać tę samą linię urządzeń, jak materiał.","Jūs turite pasirinkti tą pačią liniją įrangos, kaip ir medžiaga.",Je moet dezelfde lijn van de apparatuur als het materiaal te kiezen.,Anda harus memilih baris yang sama peralatan sebagai bahan.,Vous devez choisir la même ligne d'équipement comme matériau.,Вы должны выбрать ту же самую линию оборудования в качестве материала.,អ្នកត្រូវតែជ្រើសរើសយកបន្ទាត់ដូចគ្នានៃឧបករណ៍ជាសម្ភារៈនេះ។,,你必须选择设备的同一行的材料。,
SPEECH_RANKING_BOARD_GREETING_0,"For the glorious cats,
Freya is handing out prizes!","영예로운 고양이들에게는
여신님께서 상을 주신다!","Para os gatos gloriosos
Freya está distribuindo prêmios!",,"栄誉あるネコたちには
フレイヤ様が賞をくださる！","Freya gibt dir die Preise
für die glorreichen Katzen!",,"สำหรับแมวที่มีเกียรติ
เฟรย่าจะมอบรางวัลให้!","Ku chwale kotom,
Freya rozdaje nagrody!",,,"Untuk kucing yang berjaya
Freya akan memberikan hadiah!","Freya distribue des prix
pour les chats glorieux !",,,,对于光彩夺目的猫咪，芙蕾雅会颁发奖品！,
SPEECH_RANKING_BOARD_FILTERED_0,"Don't be afraid of
the enemy in front of you. Have faith in yourself!","눈 앞의 적을 두려워 하지 말고
자신의 내면을 믿어라!",Não tenha medo do novo inimigo à sua frente e confie em seu eu interior!,,"目の前の敵を恐れるな
自分自身を信じるのだ！","Fürchte den Feind nicht.
Habe Vertrauen in dich selbst!",,"อย่ากลัวศัตรูที่อยู่ตรงหน้า
จงเชื่อในตัวคุณเอง!","Nie lękaj się
przeciwników na swej drodze. Uwierz w siebie!",,,"Jangan takut dengan
musuh di depan Anda
percaya pada diri Anda sendiri!","Ne sois pas effrayé par
les ennemis devant toi. Aie confiance en toi !",,,,不要害怕在您面前的敌人。对自己有信心！,
SPEECH_RANKING_BOARD_ALL_0,"Don't be afraid of
the enemy in front of you. Have faith in yourself!","눈 앞의 적을 두려워 하지 말고
자신의 내면을 믿어라!",Não tenha medo do novo inimigo à sua frente e confie em seu eu interior!,,"目の前の敵を恐れるな
自分自身を信じるのだ！","Fürchte den Feind nicht.
Habe Vertrauen in dich selbst!",,"อย่ากลัวศัตรูที่อยู่ตรงหน้า
จงเชื่อในตัวคุณเอง!","Nie lękaj się
przeciwników na swej drodze. Uwierz w siebie!",,,"Jangan takut dengan
musuh di depan Anda
percaya pada diri Anda sendiri!","Ne sois pas effrayé par
les ennemis devant toi. Aie confiance en toi !",,,,不要害怕面前的敌人。对自己有信心！,
SPEECH_SHOP_MOUSE_ENTER_0,"Welcome to the market!
You can buy and sell things here!","괜찮은 물건을 제작했어?
그럼 여기 와서 팔아봐",Bem-vindo ao mercado!nova linha] Você pode comprar e vender coisas aqui!,,"マーケットへようこそ！
ここではアイテムの売買ができるわ。","Willkommen auf dem Markt!
Hier kannst du Sachen kaufen und verkaufen!",,"ยินดีต้อนรับสู่ตลาด!
คุณสามารถซื้อและขายของได้ที่นี่!","Witaj w sklepie!
Możesz tutaj sprzedawać i kupować różne rzeczy!",,,"Selamat datang di pasar!
Anda dapat membeli dan menjual barang di sini!","Bienvenu sur le marché !
Tu peux acheter et vendre des articles ici !",,,,欢迎来到市场！您可以在这里买卖东西！,
SPEECH_SHOP_CLICK_0,"If you reach level {0},
you can enter the market.",{0} 레벨을 먼저 달성해야 해.,"Se você atingir o nível {0} ,
poderá entrar no mercado.",,レベルが {0} になればマーケットに入れるわ。,"Wenn du Level {0} erreichst,
kannst du den Markt betreten.",,"คุณต้องไปถึงระดับ {0} ก่อน
ถึงจะใช้ตลาดได้","Jeśli zdobędziesz {0} poziom,
będziesz mógł wejść do sklepu.",,,"Jika Anda mencapai level {0},
Anda bisa memasuki pasar.","Tu peux entrer sur le marché une
fois que tu auras atteint le niveau {0}.",,,,如果达到{0}级，您可以进入市场。,
SPEECH_COMBINE_MOUSE_ENTER_0,"Want to make equipment or food?
Then this is the right place.","전투로 재료를 모았나?
그럼 내게 오시게","Deseja fazer equipamento ou alimentos?
Aqui.",,装備品や食料が欲しいならここだぜ。,"Du willst Ausrüstung oder Essen produzieren?
Dann bist du hier genau richtig.",,"ต้องการจะทำอุปกรณ์หรืออาหาร?
มาที่นี่.","Czy Chcesz stworzyć przedmior lub potrawę?
Tutaj.",,,"Ingin membuat perlengkapan atau makanan?
Datang kemari.","Tu veux faire un équipement ou de la nourriture ?
Alors, tu es au bon endroit.",,,,想要制作装备还是食物？这里。,
SPEECH_COMBINE_CLICK_0,"Do you want to craft items?
You need to reach level {0} first.",{0} 레벨을 먼저 달성해야 해.,"Deseja criar itens?
Você precisa atingir o nível {0} primeiro.",,"アイテムを作りたいのか？
まずレベルを {0} まで上げないとな。","Du willst neue Gegenstände herstellen?
Zuerst musst du Level {0} erreichen.",,"คุณต้องการสร้างไอเท็ม?
คุณจะต้องไปถึงระดับ {0} ก่อน","Czy chcesz wytwarzać przedmioty?
Najpierw musisz osiągnąć poziom {0}.",,,"Apakah Anda ingin membuat barang?
Anda harus mencapai level {0} terlebih dahulu.","Veux-tu créer des articles ?
Tu dois d'abord atteindre le niveau {0}.",,,,"您要制作工艺品吗？
您需要首先达到级别{0}。",
SPEECH_RANK_MOUSE_ENTER_0,"Do you want to know how strong you are?
Check out the rankings here!","영예의 전당에
이름을 올려라!","Você quer saber o quão forte você é?
Confira as classificações aqui!",,"自分の強さが知りたいか？
ここでランキングを確認するといい。","Wenn du wissen willst wie stark du bist,
kannst du dir hier die Rangliste anschauen!",,"คุณอยากรู้ว่าคุณแข็งแกร่งแค่ไหน?
ตรวจสอบการจัดอันดับได้ที่นี่!","Czy chcesz zobaczyć, jak silny jesteś?
Sprawdź ranking!",,,"Apakah Anda ingin tahu seberapa kuat Anda?
Lihat rangkingnya di sini!","Veux-tu savoir à quel point tu es fort ?
Regarde les classements ici !",,,,"您想知道自己的实力吗？
在此处查看排名！",
SPEECH_RANK_CLICK_0,"Stand back!
You can't enter until you reach level {0}.",{0} 레벨을 먼저 달성해야 해.,"Se afastem!
Você não pode entrar até atingir o nível {0}.",,"立ち去れ！
ここにはレベル {0} にならないと入ることはできぬ。","Trete zurück!
Du kannst erst eintreten, wenn du Level {0} erreicht hast.",,"ถอยกลับ!
คุณไม่สามารถเข้าได้จนกว่าจะถึงเลเวล {0}","Cofnij się!
Nie możesz wejść, dopóki nie osiągniesz poziomu {0}.",,,"Mundur!
Anda tidak bisa masuk sampai Anda mencapai level {0}.","Arrête !
Tu ne peux pas entrer tant que tu ne seras pas au niveau {0}.",,,,后退！直到达到级别{0}，您才能进入。,
SPEECH_DUNGEON_MOUSE_ENTER_0,"Press the portal below.
Let's visit other worlds and
join the battle!","아래 마법진을 누르면
탐험을 시작할 수 있다옹","Pressione o portal abaixo.
Vamos visitar outros mundos e
participe da batalha!",,"この下の魔法陣から
冒険に出かけることができるよ","Press the portal below.
Let's visit other worlds and
join the battle!",,"กดพอร์ทัลด้านล่าง
เพื่อไปโลกอื่นและ
เข้าร่วมการต่อสู้!","Naciśnij poniższy portal.
Odwiedźmy inne światy i
dołącz do bitwy!",,,"Tekan portal di bawah.
Mari kita kunjungi dunia lain dan
bergabung dalam pertempuran!","Appuie sur le portail en dessous.
Visite d'autres mondes et
rejoins le combat !",,,,"按下面的开关。
让我们参观其他世界并加入战斗吧！",
UI_LOGIN_CONTENT,"This is a community-powered
fantasy world that runs fully on the blockchain.","It is a fantasy world on the blockchain.
To start the game, you need to create your account.","Este é um mundo de fantasia
alimentado pela comunidade que roda totalmente em blockchain.",,"ここはコミュニティによって作られるファンタジー世界であり、
全てがブロックチェーン上で実行されています","Dies ist eine von der Community betriebene Fantasiewelt, die vollständig auf der Blockchain läuft.",,"มันคือโลกแฟนตาซีบนบล็อคเชน
เพื่อเริ่มเกม, คุณจะต้องสร้างบัญชีของคุณก่อน","Jest to świat fantasy, który działa w oparciu o blockchain.",,,"Ini adalah dunia fantasi yang diberdayakan
komunitas yang sepenuhnya berjalan di blockchain.","C'est un monde fantastique alimenté par la
communauté qui fonctionne entièrement sur la blockchain.",,,,这是一个完全在区块链上运行的社区驱动的幻想世界。,
UI_ACCOUNT_PLACEHOLDERS,Click the button below to create your ID,아래 버튼을 눌러 ID를 생성하세요,Clique no botão abaixo para criar seu ID,,下のボタンを押して ID を作成して下さい。,"Klicke auf die untere Schaltfläche, um deine ID zu erstellen",,คลิกปุ่มด้านล่างเพื่อสร้าง ID,"Kliknij przycisk poniżej, aby utworzyć swój identyfikator",,,Klik tombol di bawah ini untuk membuat ID Anda,Appuie sur le bouton ci-dessous pour créer ton ID.,,,,单击下面的按钮以创建您的ID,
UI_LOGIN_FIND_PASSPHRASE,For<voffset=1>g</voffset>ot passphrase?,For<voffset=1>g</voffset>ot passphrase?,Para <voffset=1></voffset>ot senha?,,パスワードを忘れましたか？,Passwort ver<voffset=1>g</voffset>essen?,,For<voffset=1>g</voffset>ot passphrase?,For<voffset=1>g</voffset>ot passphrase?,,,For<voffset=1>g</voffset>ot passphrase?,<voffset=1></voffset>Tu as oublié ton mot de passe ?,,,,忘记密码?,
UI_LOGIN_BACK_TO_LOGIN,Back to lo<voffset=1>g</voffset>in pa<voffset=1>g</voffset>e,Back to lo<voffset=1>g</voffset>in pa<voffset=1>g</voffset>e,Voltar ao lo <voffset=1></voffset>gin pa <voffset=1> ge</voffset>,,ログインページへ戻る,Zurück zum An<voffset=1>me</voffset>ldebil<voffset=1>d</voffset>schirm,,Back to lo<voffset=1>g</voffset>in pa<voffset=1>g</voffset>e,Back to lo<voffset=1>g</voffset>in pa<voffset=1>g</voffset>e,,,Kembali ke<voffset=1>g</voffset>in pa<voffset=1>g</voffset>e,Retour à la <voffset=1></voffset>page de connexion<voffset=1></voffset>,,,,返回登入页,
UI_LOGIN_LOGIN_FAIL,Login Failed,로그인 실패,Falha no Login,,ログインに失敗しました,Anmeldung fehlgeschlagen,,ล็อคอินล้มเหลว,Logowanie się nie powiodło,,,Login gagal,Connexion Échouée,,,,登录失败,
UI_LOGIN_LOGIN_CONTENT,Failed to find account,잘못된 비밀번호,Senha Inválida,,パスワードが違います,Ungültiges Passwort,,Passphrase ไม่ถูกต้อง,Nieprawidłowe hasło,,,Passphrase tidak valid,Le compte n'a pu être trouvé.,,,,无效密码,
UI_LOGIN_FINDPASSPHRASE_FAIL,,계정 찾기 실패,Falha na localização da conta,,アカウントが見つかりません,Konto nicht gefunden,,ไม่พบบัญชี,Nie udało się znaleźć konta,,,Akun tidak ditemukan,,,,,查找帐户失败,
UI_LOGIN_FINDPASSPHRASE_CONTENT,Private key not found,비밀키를 찾을 수 없음,Chave privada não encontrada,,秘密鍵が見つかりません,Privaten Schlüssel nicht gefunden,,ไม่พบ Private key,Nie znaleziono klucza prywatnego,,,Private key tidak ditemukan,Clé privée introuvable,,,,找不到私钥,
UI_LOGIN_INPUT_PASSPHRASE,Set your passphrase,비밀번호 입력,Defina sua senha,,パスワードを設定して下さい,Wähle ein Passwort,,ติดตั้ง Passphrase,Ustaw swoje hasło,,,Atur passphrase anda,Saisissez votre mot de passe,,,,设置密码,
UI_LOGIN_RETYPE_PASSPHRASE,Retype passphrase,비밀번호 재입력,Redigite sua senha,,パスワードを再入力して下さい,Bestätige dein Passwort,,ใส่ Passphrase อีกครั้ง,Wpisz ponownie hasło,,,Ketik ulang passphrase anda,Retapez votre mot de passe,,,,重新输入密码,
