Key,English,Korean,PortugueseBrazil,Portuguese,Japanese,German,Spanish,Thai,Polish,Lithuanian,Dutch,Indonesian,French,Russian,Cambodian,Urdu,ChineseSimplified,Hungarian
ERROR_FAILED_TO_UNLOCK_WORLD,Failed to unlock world.,Failed to unlock world.,Failed to unlock world.,,ワールドのロック解除に失敗しました。,Das Freischalten der Welt ist fehlgeschlagen.,,มีความผิดพลาดในการปลดล็อคโลก,Nie udało się odblokować świata.,,,Gagal membuka dunia.,,,បានបរាជ័យក្នុងការដោះសោពិភពលោក។,,无法解锁世界。,
ERROR_UNKNOWN,Unknown error occurred.,알수없는 오류가 발생했습니다.,Unknown error occurred.,Unknown error occurred.,Unknown error occurred.,Unknown error occurred.,Unknown error occurred.,Unknown error occurred.,Unknown error occurred.,Unknown error occurred.,Unknown error occurred.,Unknown error occurred.,Unknown error occurred.,Unknown error occurred.,Unknown error occurred.,Unknown error occurred.,Unknown error occurred.,Unknown error occurred.
ERROR_REQUIRE_BLOCK,The equipment is not available.,장비를 사용할 수 없습니다.,The equipment is not available.,The equipment is not available.,The equipment is not available.,The equipment is not available.,The equipment is not available.,The equipment is not available.,The equipment is not available.,The equipment is not available.,The equipment is not available.,The equipment is not available.,The equipment is not available.,The equipment is not available.,The equipment is not available.,The equipment is not available.,The equipment is not available.,The equipment is not available.
ERROR_SLOT_UNLOCK,The equipment slot is locked.,장비 슬롯이 잠겨있습니다.,The equipment slot is locked.,The equipment slot is locked.,The equipment slot is locked.,The equipment slot is locked.,The equipment slot is locked.,The equipment slot is locked.,The equipment slot is locked.,The equipment slot is locked.,The equipment slot is locked.,The equipment slot is locked.,The equipment slot is locked.,The equipment slot is locked.,The equipment slot is locked.,The equipment slot is locked.,The equipment slot is locked.,The equipment slot is locked.
ERROR_ACTION_POINT,Not enough action points.,액션 포인트가 부족합니다.,Not enough action points.,Not enough action points.,Not enough action points.,Not enough action points.,Not enough action points.,Not enough action points.,Not enough action points.,Not enough action points.,Not enough action points.,Not enough action points.,Not enough action points.,Not enough action points.,Not enough action points.,Not enough action points.,Not enough action points.,Not enough action points.
